{
  "$schema": "http://json-schema.org/draft-07/schema#",
  "title": "AnimeSourceIndex",
  "description": "What one anime episode actually contains — scenes, visible actions and spoken lines with timestamps. Built from real analysis (scene_detect, frame_sampler, transcriber, agent vision) or explicitly marked as mock. It is the only ground truth an anime_recap_plan may cite.",
  "type": "object",
  "required": ["version", "source_index_id", "provenance", "video", "scenes"],
  "properties": {
    "version": { "type": "string" },
    "source_index_id": { "type": "string", "minLength": 1 },
    "provenance": {
      "type": "object",
      "required": ["kind"],
      "properties": {
        "kind": {
          "type": "string",
          "enum": ["analyzed", "mock"],
          "description": "'analyzed' only when tools really ran on the video file; 'mock' for test or demo data."
        },
        "tools": {
          "type": "array",
          "items": { "type": "string" },
          "description": "Tools that produced the data, e.g. scene_detect, frame_sampler, transcriber(large-v3, ja)."
        },
        "note": { "type": "string" },
        "transcript_origin": {
          "type": "string",
          "enum": ["faster_whisper", "external_file"],
          "description": "faster_whisper = transcriber ran in this build; external_file = a transcriber JSON produced earlier was supplied."
        },
        "visual_review": {
          "type": "string",
          "enum": ["pending", "partial", "complete"],
          "description": "How many scenes the agent has visually annotated from keyframes (lib/anime_source_indexer.py annotate)."
        }
      }
    },
    "video": {
      "type": "object",
      "required": ["path", "fps", "duration_seconds"],
      "properties": {
        "path": { "type": "string" },
        "fps": { "type": "number", "exclusiveMinimum": 0 },
        "duration_seconds": { "type": "number", "exclusiveMinimum": 0 },
        "has_subtitles": { "type": "boolean", "description": "A subtitle stream exists in the container (burned-in text is not detected)." },
        "has_audio": { "type": "boolean", "description": "The file has an audio stream." },
        "width": { "type": "integer", "minimum": 0 },
        "height": { "type": "integer", "minimum": 0 }
      }
    },
    "characters": {
      "type": "array",
      "items": {
        "type": "object",
        "required": ["character_id", "name_ja"],
        "properties": {
          "character_id": { "type": "string" },
          "name_ja": { "type": "string" },
          "name_vi": { "type": "string" }
        }
      }
    },
    "scenes": {
      "type": "array",
      "minItems": 1,
      "items": {
        "type": "object",
        "required": ["scene_id", "start_seconds", "end_seconds", "visual_summary"],
        "properties": {
          "scene_id": { "type": "string", "minLength": 1 },
          "start_seconds": { "type": "number", "minimum": 0 },
          "end_seconds": { "type": "number", "exclusiveMinimum": 0 },
          "visual_summary": { "type": "string", "description": "What is visible on screen (Japanese). Observation only, no interpretation." },
          "characters": { "type": "array", "items": { "type": "string" } },
          "actions": { "type": "array", "items": { "type": "string" } },
          "reactions": { "type": "array", "items": { "type": "string" }, "description": "Visible reactions (表情・リアクション) observed in the keyframes." },
          "visual_review": {
            "type": "string",
            "enum": ["pending", "done"],
            "description": "pending = visual fields not yet filled from keyframes; done = the agent annotated this scene."
          },
          "keyframes": {
            "type": "array",
            "items": {
              "type": "object",
              "required": ["timestamp_seconds", "path"],
              "properties": {
                "timestamp_seconds": { "type": "number", "minimum": 0 },
                "path": { "type": "string" }
              }
            }
          },
          "dialogue": {
            "type": "array",
            "items": {
              "type": "object",
              "required": ["line_id", "start_seconds", "end_seconds", "text_ja"],
              "properties": {
                "line_id": { "type": "string", "minLength": 1 },
                "start_seconds": { "type": "number", "minimum": 0 },
                "end_seconds": { "type": "number", "exclusiveMinimum": 0 },
                "speaker": { "type": ["string", "null"], "description": "character_id, or null when the speaker is not identified." },
                "text_ja": { "type": "string" },
                "text_vi": { "type": "string" },
                "asr_confidence": { "type": "number", "minimum": 0, "maximum": 1, "description": "Mean faster-whisper word probability." },
                "low_confidence": { "type": "boolean", "description": "Do not quote until verified: low ASR confidence, a known hallucination, or marked unreliable." },
                "asr_flags": {
                  "type": "array",
                  "items": { "type": "string", "enum": ["split_at_scene_cut", "no_word_timestamps", "known_hallucination", "likely_no_speech", "agent_marked_unreliable"] },
                  "description": "Why a line may need checking."
                },
                "loudness_db": { "type": "number", "description": "RMS level of the line's audio (dBFS, 16 kHz mono)." },
                "excite": {
                  "type": "number", "minimum": 0, "maximum": 3,
                  "description": "Heuristic beat-mining signal: loudness above the episode median, exclamations, short lines. Not story understanding."
                }
              }
            }
          }
        }
      }
    }
  }
}
